{
  "schema_version": "v1",
  "stage_id": "L04_P13_P14_SCALE_AUDIT_AND_REFRESH",
  "status": "PASS",
  "completed_at": "2026-06-30T07:57:31Z",
  "commit_sha": "c398901976daf1b1b870259d754bc0f504871c88",
  "pushed": true,
  "previous_harness_passed": true,
  "current_harness_passed": true,
  "subagent_verdicts": {
    "requirements_analyst": "APPROVED",
    "harness_architect": "APPROVED",
    "risk_auditor": "APPROVED",
    "implementation_worker": "APPROVED",
    "review_agent": "APPROVED",
    "validation_agent": "APPROVED",
    "anti_regression_guardian": "APPROVED"
  },
  "commands_log": "artifacts/loop_engineering/stages/L04_P13_P14_SCALE_AUDIT_AND_REFRESH/commands.jsonl",
  "artifacts": [
    "artifacts/loop_engineering/stages/L04_P13_P14_SCALE_AUDIT_AND_REFRESH/read_context.md",
    "artifacts/loop_engineering/stages/L04_P13_P14_SCALE_AUDIT_AND_REFRESH/stage_state.json",
    "artifacts/loop_engineering/stages/L04_P13_P14_SCALE_AUDIT_AND_REFRESH/commands.jsonl",
    "artifacts/loop_engineering/stages/L04_P13_P14_SCALE_AUDIT_AND_REFRESH/previous_harness_result.json",
    "artifacts/loop_engineering/stages/L04_P13_P14_SCALE_AUDIT_AND_REFRESH/subagents/requirements_analyst.json",
    "artifacts/loop_engineering/stages/L04_P13_P14_SCALE_AUDIT_AND_REFRESH/subagents/harness_architect.json",
    "artifacts/loop_engineering/stages/L04_P13_P14_SCALE_AUDIT_AND_REFRESH/subagents/risk_auditor.json",
    "artifacts/loop_engineering/stages/L04_P13_P14_SCALE_AUDIT_AND_REFRESH/stage_design.md",
    "artifacts/loop_engineering/stages/L04_P13_P14_SCALE_AUDIT_AND_REFRESH/current_harness_plan.json",
    "schemas/artifact/p13_p14_scale_audit.schema.json",
    "scripts/audit_p13_p14_scale.py",
    "tests/scale/test_p13_p14_scale_audit.py",
    "tests/ci/test_p13_p14_scale_audit_gate.py",
    ".github/workflows/github-coverage-gates.yml",
    "artifacts/loop_engineering/reports/p13_p14_scale_audit.json",
    "artifacts/loop_engineering/stages/L04_P13_P14_SCALE_AUDIT_AND_REFRESH/subagents/implementation_worker.json",
    "artifacts/loop_engineering/stages/L04_P13_P14_SCALE_AUDIT_AND_REFRESH/subagents/review_agent.json",
    "artifacts/loop_engineering/stages/L04_P13_P14_SCALE_AUDIT_AND_REFRESH/subagents/validation_agent.json",
    "artifacts/loop_engineering/stages/L04_P13_P14_SCALE_AUDIT_AND_REFRESH/subagents/anti_regression_guardian.json",
    "artifacts/loop_engineering/stages/L04_P13_P14_SCALE_AUDIT_AND_REFRESH/anti_regression_check.json",
    "artifacts/loop_engineering/stages/L04_P13_P14_SCALE_AUDIT_AND_REFRESH/anti_regression_report.md",
    "artifacts/loop_engineering/stages/L04_P13_P14_SCALE_AUDIT_AND_REFRESH/validation_result.json",
    "artifacts/loop_engineering/stages/L04_P13_P14_SCALE_AUDIT_AND_REFRESH/stage_result.json"
  ],
  "metrics_added": [
    "p13_p14_scale_audit:2 canonical P13 rungs audited",
    "p13_p14_scale_audit:2 real Valkey evidence artifacts checked",
    "p13_p14_scale_audit:P14 dry-run boundary checked with zero default real evidence"
  ],
  "visualizations_added": [],
  "real_valkey_gates": [],
  "fake_gates": [
    "p13_p14_scale_audit_static_builder",
    "p13_p14_scale_audit_schema_validation",
    "p13_p14_scale_audit_unit_tests",
    "p13_p14_scale_audit_ci_guard",
    "loop_engineering_anti_regression"
  ],
  "known_missing_metrics": [
    {
      "metric": "p14.real_valkey_coverage",
      "status": "SKIPPED_WITH_REASON",
      "reason": "P14 is non-automatic opt-in dry-run/resource/planner only in this session; L04 audits the boundary without running P14.",
      "value": false
    },
    {
      "metric": "p13_historical_gate_manifest_sha_current_match",
      "status": "SKIPPED_WITH_REASON",
      "reason": "Committed P13 gate_result has allowlisted historical manifest SHA drift recorded as nonblocking historical evidence; L04 does not rewrite historical gate artifacts.",
      "value": "historical"
    }
  ],
  "risks_remaining": [
    "L04 is a static artifact audit stage. It consumes committed P13 real Valkey evidence but does not rerun P13/P14 real or dry-run wrappers.",
    "P13 historical manifest/scale_tests command drift remains recorded as explicit nonblocking historical findings; historical gate artifacts were not rewritten."
  ]
}
