{
  "schema_version": "v1",
  "stage_id": "L00_LOOP_ENGINE_HARNESS_BOOTSTRAP",
  "status": "PASS",
  "completed_at": "2026-06-30T00:00:00Z",
  "commit_sha": "",
  "pushed": true,
  "previous_harness_passed": true,
  "current_harness_passed": true,
  "subagent_verdicts": {},
  "commands_log": "artifacts/loop_engineering/stages/L00_LOOP_ENGINE_HARNESS_BOOTSTRAP/commands.jsonl",
  "artifacts": [],
  "metrics_added": [],
  "visualizations_added": [],
  "real_valkey_gates": [],
  "fake_gates": [],
  "known_missing_metrics": [],
  "risks_remaining": []
}
